{
  "schemaVersion": "1",
  "reportKind": "matcher-v2-to-v3-delta",
  "inputHashes": {
    "matcherV2HistoryChecksumManifestSha256": "04ed4d840b20a5cd681ee25303d0488e32aeaef46007a765c7ad29fd2c702f1a",
    "matcherV2ReportSha256": "d53225fbafeda78048726d201b230c6c24f0f8f68348e827b096f754406110cf",
    "matcherV3ReportSha256": "9c233bb0e6ff2e9862e5241fc62f992e4e81f736ee44cac17eca34b8bdefa00a",
    "holdoutManifestSha256": "b9cf6325e2758889449aa021b5b45b3636e17a0dcf65d3c7dba215c2964fe379"
  },
  "matcherV2": {
    "evaluation": {
      "repositoryCommitSha": "df45e021bc4d2b3c2fd0155bf75ae3967ee80b0d",
      "sourceTreeSha256": "317f294b9f52ea9ec78388f9bb96e219d3de4db2607d48c9e9fae1e8be21f7cf",
      "sarifRegressToolVersion": "0.1.0",
      "matcherAlgorithmVersion": "sarifregress/matcher/v2",
      "fingerprintAlgorithmVersions": [
        {
          "name": "derived-fingerprint",
          "version": "rule-path-context/v2"
        },
        {
          "name": "derived-fingerprint-compare",
          "version": "sarifregress/derived-fingerprint-compare/v1"
        },
        {
          "name": "embedded-snippet",
          "version": "embedded-snippet/v1"
        },
        {
          "name": "producer-fingerprint-common",
          "version": "sarifregress/producer-fingerprint-common-version/v1"
        }
      ],
      "outputSchemaVersion": "1",
      "configurationSchemaVersion": "1",
      "holdoutManifestSha256": "b9cf6325e2758889449aa021b5b45b3636e17a0dcf65d3c7dba215c2964fe379"
    },
    "aggregate": {
      "groundTruthUnits": 99,
      "labelledRelationships": 75,
      "labelledMatches": 0,
      "truePositives": 0,
      "falsePositives": 0,
      "falseNegatives": 75,
      "classificationMismatches": 0,
      "expectedNewClassifications": 9,
      "newClassifications": 30,
      "correctNewClassifications": 3,
      "incorrectNewClassifications": 6,
      "newClassificationAccuracy": 0.333333,
      "expectedResolvedClassifications": 9,
      "resolvedClassifications": 30,
      "correctResolvedClassifications": 3,
      "incorrectResolvedClassifications": 6,
      "resolvedClassificationAccuracy": 0.333333,
      "ambiguousClassifications": 60,
      "correctAmbiguityRefusals": 2,
      "unexpectedAmbiguityRefusals": 25,
      "incorrectlyAutoMatchedAmbiguousCases": 0,
      "ingestionFailures": 2,
      "structuralFailures": 0,
      "precision": 1,
      "recall": 0,
      "f1": 0
    },
    "producers": [
      {
        "producerId": "gitleaks",
        "metrics": {
          "groundTruthUnits": 33,
          "labelledRelationships": 25,
          "labelledMatches": 0,
          "truePositives": 0,
          "falsePositives": 0,
          "falseNegatives": 25,
          "classificationMismatches": 0,
          "expectedNewClassifications": 3,
          "newClassifications": 0,
          "correctNewClassifications": 0,
          "incorrectNewClassifications": 3,
          "newClassificationAccuracy": 0,
          "expectedResolvedClassifications": 3,
          "resolvedClassifications": 0,
          "correctResolvedClassifications": 0,
          "incorrectResolvedClassifications": 3,
          "resolvedClassificationAccuracy": 0,
          "ambiguousClassifications": 60,
          "correctAmbiguityRefusals": 2,
          "unexpectedAmbiguityRefusals": 25,
          "incorrectlyAutoMatchedAmbiguousCases": 0,
          "ingestionFailures": 0,
          "structuralFailures": 0,
          "precision": 1,
          "recall": 0,
          "f1": 0
        }
      },
      {
        "producerId": "pmd",
        "metrics": {
          "groundTruthUnits": 33,
          "labelledRelationships": 25,
          "labelledMatches": 0,
          "truePositives": 0,
          "falsePositives": 0,
          "falseNegatives": 25,
          "classificationMismatches": 0,
          "expectedNewClassifications": 3,
          "newClassifications": 30,
          "correctNewClassifications": 3,
          "incorrectNewClassifications": 0,
          "newClassificationAccuracy": 1,
          "expectedResolvedClassifications": 3,
          "resolvedClassifications": 30,
          "correctResolvedClassifications": 3,
          "incorrectResolvedClassifications": 0,
          "resolvedClassificationAccuracy": 1,
          "ambiguousClassifications": 0,
          "correctAmbiguityRefusals": 0,
          "unexpectedAmbiguityRefusals": 0,
          "incorrectlyAutoMatchedAmbiguousCases": 0,
          "ingestionFailures": 0,
          "structuralFailures": 0,
          "precision": 1,
          "recall": 0,
          "f1": 0
        }
      },
      {
        "producerId": "semgrep",
        "metrics": {
          "groundTruthUnits": 33,
          "labelledRelationships": 25,
          "labelledMatches": 0,
          "truePositives": 0,
          "falsePositives": 0,
          "falseNegatives": 25,
          "classificationMismatches": 0,
          "expectedNewClassifications": 3,
          "newClassifications": 0,
          "correctNewClassifications": 0,
          "incorrectNewClassifications": 3,
          "newClassificationAccuracy": 0,
          "expectedResolvedClassifications": 3,
          "resolvedClassifications": 0,
          "correctResolvedClassifications": 0,
          "incorrectResolvedClassifications": 3,
          "resolvedClassificationAccuracy": 0,
          "ambiguousClassifications": 0,
          "correctAmbiguityRefusals": 0,
          "unexpectedAmbiguityRefusals": 0,
          "incorrectlyAutoMatchedAmbiguousCases": 0,
          "ingestionFailures": 2,
          "structuralFailures": 0,
          "precision": 1,
          "recall": 0,
          "f1": 0
        }
      }
    ]
  },
  "matcherV3": {
    "evaluation": {
      "repositoryCommitSha": "f91dfbd4328fb5680b0a5197408b09132692ce8a",
      "sourceTreeSha256": "2de20c3e0e1e5452610af2210d28e9b4b2fef6f3dc87f1ed04e6fa3703261fc1",
      "sarifRegressToolVersion": "0.1.0",
      "matcherAlgorithmVersion": "sarifregress/matcher/v3",
      "fingerprintAlgorithmVersions": [
        {
          "name": "derived-fingerprint",
          "version": "rule-path-context/v2"
        },
        {
          "name": "derived-fingerprint-compare",
          "version": "sarifregress/derived-fingerprint-compare/v2"
        },
        {
          "name": "embedded-snippet",
          "version": "embedded-snippet/v1"
        },
        {
          "name": "producer-fingerprint-common",
          "version": "sarifregress/producer-fingerprint-common-version/v1"
        }
      ],
      "outputSchemaVersion": "1",
      "configurationSchemaVersion": "1",
      "holdoutManifestSha256": "b9cf6325e2758889449aa021b5b45b3636e17a0dcf65d3c7dba215c2964fe379"
    },
    "aggregate": {
      "groundTruthUnits": 99,
      "labelledRelationships": 75,
      "labelledMatches": 50,
      "truePositives": 50,
      "falsePositives": 0,
      "falseNegatives": 25,
      "classificationMismatches": 5,
      "expectedNewClassifications": 9,
      "newClassifications": 36,
      "correctNewClassifications": 9,
      "incorrectNewClassifications": 0,
      "newClassificationAccuracy": 1,
      "expectedResolvedClassifications": 9,
      "resolvedClassifications": 36,
      "correctResolvedClassifications": 9,
      "incorrectResolvedClassifications": 0,
      "resolvedClassificationAccuracy": 1,
      "ambiguousClassifications": 8,
      "correctAmbiguityRefusals": 4,
      "unexpectedAmbiguityRefusals": 0,
      "incorrectlyAutoMatchedAmbiguousCases": 0,
      "ingestionFailures": 0,
      "structuralFailures": 0,
      "precision": 1,
      "recall": 0.666667,
      "f1": 0.800000
    },
    "producers": [
      {
        "producerId": "gitleaks",
        "metrics": {
          "groundTruthUnits": 33,
          "labelledRelationships": 25,
          "labelledMatches": 25,
          "truePositives": 25,
          "falsePositives": 0,
          "falseNegatives": 0,
          "classificationMismatches": 5,
          "expectedNewClassifications": 3,
          "newClassifications": 3,
          "correctNewClassifications": 3,
          "incorrectNewClassifications": 0,
          "newClassificationAccuracy": 1,
          "expectedResolvedClassifications": 3,
          "resolvedClassifications": 3,
          "correctResolvedClassifications": 3,
          "incorrectResolvedClassifications": 0,
          "resolvedClassificationAccuracy": 1,
          "ambiguousClassifications": 4,
          "correctAmbiguityRefusals": 2,
          "unexpectedAmbiguityRefusals": 0,
          "incorrectlyAutoMatchedAmbiguousCases": 0,
          "ingestionFailures": 0,
          "structuralFailures": 0,
          "precision": 1,
          "recall": 1,
          "f1": 1
        }
      },
      {
        "producerId": "pmd",
        "metrics": {
          "groundTruthUnits": 33,
          "labelledRelationships": 25,
          "labelledMatches": 0,
          "truePositives": 0,
          "falsePositives": 0,
          "falseNegatives": 25,
          "classificationMismatches": 0,
          "expectedNewClassifications": 3,
          "newClassifications": 30,
          "correctNewClassifications": 3,
          "incorrectNewClassifications": 0,
          "newClassificationAccuracy": 1,
          "expectedResolvedClassifications": 3,
          "resolvedClassifications": 30,
          "correctResolvedClassifications": 3,
          "incorrectResolvedClassifications": 0,
          "resolvedClassificationAccuracy": 1,
          "ambiguousClassifications": 0,
          "correctAmbiguityRefusals": 0,
          "unexpectedAmbiguityRefusals": 0,
          "incorrectlyAutoMatchedAmbiguousCases": 0,
          "ingestionFailures": 0,
          "structuralFailures": 0,
          "precision": 1,
          "recall": 0,
          "f1": 0
        }
      },
      {
        "producerId": "semgrep",
        "metrics": {
          "groundTruthUnits": 33,
          "labelledRelationships": 25,
          "labelledMatches": 25,